{
    "candidate_id": "CAND001",
    "job_id": "JD001",
    "application_id": "APP001",
    "report_version": "v1",
    "created_at": "2026-08-17T11:30:00+05:30",
    "model_version": "screening-model-v1.0",
    "screening_score": 82,
    "strengths": [
        "Strong Python knowledge",
        "Good SQL experience",
        "Experience building APIs"
    ],
    "weaknesses": [
        "Limited Django experience"
    ],
    "recommendation": "Proceed to interview",
    "status": "completed"
}